{
  "schemaVersion": 1,
  "generatedAt": "2026-07-27T12:00:00.000Z",
  "monitoringStartedAt": "2026-07-01T00:00:00.000Z",
  "services": [
    {
      "id": "website",
      "name": "Website",
      "status": "operational",
      "checks": [
        {
          "id": "edge-primary",
          "protocol": "ipv4",
          "status": "operational",
          "checkedAt": "2026-07-27T11:59:00.000Z",
          "responseTimeMs": 108
        },
        {
          "id": "edge-secondary",
          "protocol": "ipv6",
          "status": "operational",
          "checkedAt": "2026-07-27T11:59:05.000Z",
          "responseTimeMs": 121
        }
      ],
      "dailyAvailability": [
        {
          "date": "2026-07-26",
          "monitoredSeconds": 86400,
          "unavailableSeconds": 0
        }
      ]
    }
  ]
}
