{
  "schemaVersion": 1,
  "generatedAt": "2026-07-27T12:00:00.000Z",
  "monitoringStartedAt": "2026-07-20T00:00:00.000Z",
  "services": [
    {
      "id": "storage",
      "name": "Storage",
      "status": "operational",
      "checks": [
        {
          "id": "origin",
          "protocol": "ipv4",
          "status": "operational",
          "checkedAt": "2026-07-27T11:59:00.000Z",
          "responseTimeMs": 76
        }
      ],
      "dailyAvailability": []
    }
  ]
}
