{
  "schemaVersion": 1,
  "generatedAt": "2026-07-27T12:00:00.000Z",
  "monitoringStartedAt": "2026-07-26T12:00:00.000Z",
  "services": [
    {
      "id": "backend",
      "name": "Backend",
      "status": "degraded",
      "checks": [
        {
          "id": "primary",
          "protocol": "ipv4",
          "status": "degraded",
          "checkedAt": "2026-07-27T11:59:00.000Z",
          "responseTimeMs": 843
        }
      ],
      "dailyAvailability": [
        {
          "date": "2026-07-26",
          "monitoredSeconds": 43200,
          "unavailableSeconds": 120
        },
        {
          "date": "2026-07-27",
          "monitoredSeconds": 43200,
          "unavailableSeconds": 0
        }
      ]
    }
  ]
}
